url,time,content,title,abstract
王娟娟,,华豚横刀夺“爱”均瑶回击 爱建集团股权争斗一触即发,"借定增之举，均瑶集团距离拿到爱建集团控制权仅有“一步之遥”，却意外杀出个看准爱建集团金融牌照的华豚。双方“你来我往”，相继抛出增持计划，对第一大股东的交椅互不相让。而爱建集团目前的第一大股东上海工商界爱国建设特种基金会(下称“爱建基金会”)则以公开声明方式力挺均瑶集团，围绕着这家股权分散的老牌金控上市平台的股权争夺战一触即发。
4月17日晚间，爱建集团发布三份重要公告，在宣布公司17亿元的定增方案终于过会的同时，公告了均瑶集团“未来12个月内增持不低于3%股份”的计划，这一增持计划在外界看来，为的就是阻击上述“门口的野蛮人”。在此前的一周内，上海华豚企业管理有限公司(下称“华豚企业”)及其一致行动人广州基金国际股权投资基金管理有限公司(下称“广州基金国际”)闪电增持爱建集团，触及举牌线并明确拟以第一大股东的身份，改组爱建集团目前董事会，主导上市公司。
对于这一新晋的举牌方，爱建集团方面在接受第一财经记者采访时表示“意外”，按照原定的增持计划，定增实施后，均瑶集团将以17.67%的持股接力上海国资委，成为公司的实际控制人。面对突然杀出的“野蛮人”，爱建基金会选择与均瑶结盟，并表态“考虑采取包括但不限于与均瑶集团形成一致行动关系等措施”。
不过，对于爱建的实际控制权，华豚一方未有退让之意。华豚企业董事长顾颉在接受第一财经记者采访时表示，公司将在合规之下，第一步先完成2.1%的增持计划，后续增持资金亦有安排，将根据市场以及均瑶集团的情况而定。对于下一步的增持计划，第一财经记者亦试图联系均瑶集团董事长王均金，但截至发稿未有回应。不过，仅以目前爱建集团的股价与股权机构来看，拿下上市公司控制权，华豚一方或将付出数十亿成本。
“虽然爱建旗下的证券、信托等的资质都比较一般，但和其他的地方金控平台相比，它手里有多张金融牌照，且股权分散增持压力小。”如一长期跟踪爱建集团的非银分析师所说，华豚之所以闪电增持爱建集团，盯上的就是后者手中的金融牌照，尤其是核心的信托牌照。
年报信息显示，爱建集团平台目前旗下共有6家核心子公司，包括爱建信托(持股99.33%)、爱建资本、爱建资产管理公司、爱建融资租赁公司、爱建财富管理公司及爱建产业发展公司。其中，爱建信托为2016年实现净利润5.79亿元，为爱建集团贡献了超九成利润。
对于看上爱建集团的牌照，华豚一方也并不避讳。顾颉告诉第一财经记者，作为老牌金融集团，爱建集团的金融牌照，尤其信托牌照非常有吸引力。
“从公司的发展经历来看，爱建集团的法人治理结构不是很完善，广州基金国际和我们也有约定，准备未来把公司打造成全牌照的金融集团。”顾颉表示。
华豚企业的此次举牌有备而来。第一财经记者查阅工商资料发现，华豚企业成立于2014年7月，于今年4月1日进行了增资扩股，引入了背靠广州国资委的广州汇垠天粤国际，形成了顾颉持股33.34%(法定代表人)、华豚集团持股33.33%、汇垠天粤持股33.33%的股权结构。而汇垠天粤则为广州基金国际的控股股东，同样隶属广州市国资委。
按照顾颉所说，4月1日的增资扩股为的就是举牌爱建集团。汇垠天粤董事长闵飞则强调，本次增持获得了广州市国资委的支持。接近广州基金国际的人士亦对第一财经记者表示，实际上这一举牌透露出的或是广东国资想在金融领域亦有所新作为。
虽然顾颉一再表明，本次举牌并未有做“门口的野蛮人或者妖精”之意，但仍然难以打消外界的疑虑，对于增持资金的来源质疑亦未消除。对此，顾颉回应称，目前增持资金均来自于华豚企业的注册资本，后续增持资金亦有安排。工商信息显示，华豚企业注册资本合计27亿元。
对于爱建集团目前的经营现状，华豚一方认为，爱建集团目前已落后同期拿到牌照的其他的老牌金融集团。若华豚一方成为爱建的第一大股东，改选董事会，调整法人治理结构势在必行。
以目前爱建集团的董事会席位来看，显然上市公司以及爱建基金会与均瑶集团暂为盟友。公开信息显示，爱建集团目前的6名非独立董事中，有三名为均瑶集团推荐，且均瑶集团董事长王均金已于2016 年7 月当选为爱建集团董事长。
实际上，早在2015年，均瑶集团就开始谋划取得爱建集团控制权。2015年8月28日，均瑶集团与上海国际集团签订股权转让协议，协议受让爱建集团7.08%股权。随后11月，爱建集团公司公告定增方案，向均瑶集团、王均金、王均豪非公开发行非公开发行1.8亿股，购买其合计持有的均瑶乳业99.8125%股权。
2017年1月25日，爱建集团调整方案为发行1.85亿股，共募资17亿元。12 亿元用于向爱建信托增资，4 亿元通过爱建信托投资创投项目，1 亿元用于偿还银行借款。而定增若完成，均瑶集团的持股比例将上升至17.67%，为第一大股东。且爱建集团6个非独立董事席位中均瑶集团有权推荐5 名候选人。
上述分析师认为，从持股比例上来说，如果定增顺利，对于拿下爱建集团控制权，均瑶集团更为有利。就在华豚集团宣布举牌后第二天，均瑶集团亦公告，计划于未来12 个月增持爱建集团股份不少于3%。而作为爱建集团当下的大股东，爱建特种基金会明确支持均瑶集团取得上市公司实际控制人地位，并表达了对华豚集团的“警惕”。
“若相关股东进一步增持股份,且其后续行为对上市公司稳定发展产生不利影响的,本基金会将在符合相关法律法规以及信息披露要求的基础上,考虑采取包括但不限于与均瑶集团形成一致行动关系等各项积极措施,以全力支持爱建集团的后续发展。”爱建集团方面表示。
对于持股比例的争夺，华豚一方与均瑶集团均不相让。“若对方继续增持，我们也有信心继续增持。”4月18日下午，华豚方面对第一财经记者这样表示。仅以目前爱建集团的股权结构和股价来看，若爱建基金会与均瑶集团结成一致行动人，两方持股19.38%，华豚一方想拿下控制权则需要近30亿元。
另有非银分析人士对第一财经记者表示，目前爱建集团两方争夺控制权的局面，或对其复牌后股价走势有利，一干基金将搭顺风车获利，但股价水涨船高对于增持双方来说成本均不可避免上升，争斗局面将走向何方仍难预测。",http://www.yicai.com/news/5268836.html
黄思瑜,,李福成“嫌”福成股份股价不理想 放弃减持引来市场猜测,"因股价未曾到达理想价位，福成股份(600965.SH)实际控制人之一李福成的减持计划最终未予兑现。而这一个直截了当而又似存隐性信号的理由也引来市场诸多猜测。
李福成的减持计划是于去年9月19日公布，当时的减持底价定为13.58 元/股，而在减持计划期间，福成股份的股价曾最高涨至16.86元/股。以每股9元左右的成本价计算，李福成在减持计划期间的获利金额最大可达到2亿元左右。然而李福成并未有所心动。
对于此次公布的减持理由以及背后是否有其他原因，市场存有诸多猜测，比如，减持的理由似乎有向市场传递股价存上涨预期的信号，是否有沾染雄安概念推高股价预期。对此，福成股份内部人士回应称，李福成仅是反应自身的真实想法，该公司与雄安新区并无关联，也并不想往该概念上靠。
一位证券律师表示，虽然福成股份有向市场释放股价上涨预期的嫌疑，但并不好定性，股东表达对企业充满信心类的话也属正常。
4月17日晚间，福成股份的一份减持计划进展公告引起市场注意，重点在于那句不减持的理由。
根据公告内容，李福成原计划减持不超其所持公司股份总数的25%，但由于该公司股价未曾到达李福成的理想价位，故李福成尚未兑现减持计划。
福成股份是去年9月19日抛出李福成的减持计划，李福成因个人资金需求，拟通过大宗交易或集中竞价交易的方式进行减持，通过大宗交易减持需在今年3月23日之前完成，以集中竞价交易方式减持则需在今年4月18日之前完成。当时，李福成持有该公司1.28亿股，占总股本的15.65%;其中持有流通股1.1亿股，占总股本的13.49%。
事实上，当时李福成也给出了减持的底价，即不低于福成股份2016年9月19日收市后股票收盘价13.58 元/股。而在减持计划期间，福成股份的股价曾最高涨至16.86元/股。
“那会每股股价达到16元多的时候，他都不想卖，他都觉得低，后来股价下来了，他就一直也没有动静。”福成股份内部人士向第一财经表示。
而李福成持有福成股份的持股成本在9元左右。具体来看，2013年12月份，李福成通过定增认购福成股份1358.21万股，认购价格为5.96元/股，解禁期为2016年12月11日;2014年7月，因福成股份实施每10股转增3股方案，李福成持股增加至1765.67万股;2015年7月28日至2015年8月27日股灾期间，李福成累计增持 1000.677万股，平均持股价格为10.896元/股;2015年12月24日，李福成通过协议转让受让福成投资集团有限公司约1亿股流通股，受让价格为9.25 元/股。
如此看来，若以16元/股的价格来套现，李福成在减持计划期间的获利金额最大可达到2亿元左右。然而李福成并未有所心动。上述内部人士表示，他(李福成)应该是对企业继续看好，如果不减持的话，可能通过其他途径来筹集资金，他自己有别的投资需要钱。
对福成股份而言，上述减持计划曾让该公司股价有所波动。“当减持这个信息出来之后，股票上涨了一波行情，当时市场预期这么大的减持背后可能会有一个资金量很大的接盘方，存有一个想象空间，但涨到16元左右时还没减持动静，之后股价一直往下跌，减持又像一把利剑悬在头上。”上述内部人士描述当时的市场反应时表示。
如今这一减持计划到期并搁浅。福成股份公告称，目前，李福成因个人身体健康原因及为培养家族事业接班人，已辞去该公司董事职务。根据有关规定，李福成自2017年3月21日辞去公司董事职务后六个月内不转让其所持有的公司股份。
然而，市场对李福成公开的不减持理由以及是否背后还有其他原因存有诸多揣测。
“没减持的原因有可能是看好雄安新区概念对福成股份构成利好。”有投资者猜测，设立雄安新区的消息出来后，该股涨幅并不及其他雄安概念股，可能是想以此吸引市场的注意力。
根据二级市场盘面情况，在雄安新区的消息出来之后，涉及房地产、基建等方面的雄安概念股集体爆发，而福成股份清明节后首个交易日(4月5日)上涨逾5%，并未如其他概念股一样涨停，第二个交易日便下挫逾4%，第4和第5个交易拔高上涨后再一路下滑。截至4月18日，该股收报13.08元/股。
对此上述内部人士表示，该公司在雄安新区并没有土地，目前在那里也没有开展业务，“雄安新区跟我们应该是没什么直接关联”，公司也没有想往雄安新区概念股上靠。
据悉，4月11日下午，河北省金融办会同河北省证监局，约谈了全省52家上市企业主要负责人，提出稳定股价，严防不良炒作等要求，稳定资本市场，为雄安新区建设营造良好的金融生态环境。
也有市场人士认为，“股价未曾到达理想价位”这一不减持的理由似乎有向市场传递股价存上涨预期的信号，暗藏煽动投资者去买入之意，而目前监管层正在严打市场操纵行为。
“这不至于，那个减持理由是他(李福成)自己的一个真实想法。”上述内部人士表示，该公司发这个公告是因为减持期限到期了，必须要发公告，而且李福成也认为现在股价处于低位。
此外，有观点认为，可能是目前该公司在培养接班人，后续有打压股价计划，以让接班人低价增持，再拉高股价。但上述内部人士表示，这个不太现实，李福成家族持有福成股份超过60%，不可能会再从二级市场上增持股份。
对于李福成的减持理由，一位证券律师表示，虽有向市场释放股价上涨预期的嫌疑，但并不好定性，股东表达对企业充满信心类的话也属正常。
福成股份目前为畜牧养殖及屠宰、食品加工行业，餐饮服务行业，殡葬服务行业的多主业格局。该公司一季度业绩快报显示，营业收入为3亿元，同比下降11.73;净利润为2477.04万元，同比下降39.24%。
上述内部人士表示，未来公司的发展重心将慢慢倾向于殡葬服务业，前两个业务将会慢慢削弱化，因为殡葬业风险较小，预期收益、毛利率均较为稳定，而畜牧养殖和食品安全方面均存在不可控的风险。",http://www.yicai.com/news/5268819.html
江怡曼 尹婧霏,,炒作雄安股套现25亿元  “最牛营业部”操作路线曝光,"炒作雄安概念股者众，可是如“最牛营业部”一般、套现25亿元则实属少见。
冀东水泥、京汉股份、荣盛发展、金隅股份——这些股票可谓本轮雄安概念股炒作中名气“如雷贯耳”的大龙头，而这些龙头股被一家叫做华泰证券北京西三环北路的营业部悉数捕获，并且在最近几个交易日内成功实现大手笔卖出套现，仅仅4月17日就顺利套现了15.42亿元，前后共计卖出雄安概念股套现25.21亿元。
4月18日，第一财经记者来到这家营业部实地探访，发现该营业部聚集了不少个人投资者。该营业部工作人员表示，上述这么大的交易量他们也很少看到。
从公开信息中可以看到，该营业部近期的“战果”还远不止雄安概念股。自3月份以来，该营业部就热衷于“炒地图”，除了雄安概念之外，还操作了粤港澳、一带一路概念的热门股，从走势来看，这些股票的股价都出现过大幅飙涨。
第一财经记者来到位于世纪华贸大厦A座的华泰证券北京西三环北路营业部时候，看到有不少个人投资者正在营业部内。该营业部一共有两层区域，一楼的面积仅有十余平方米，有客户经理正在为投资者办理证券账户的开户。三楼的营业厅则更为宽敞，以走廊为分界线分为两大办公区，一个办公区主要为股民办理融资融券等业务，另一大区域有几间大户室接待资金量在几千万元以上的大户。
“在我们营业部如此大手笔的交易也很少见，不然也不会上榜龙虎榜。”该营业部的一位客户经理告诉记者，一般个人投资者很少有这么大的资金量，一般的私募游资也很难做到这么大的量，总体来说，一家私募机构的日交易金额超过2亿元就算比较大的了。
但该客户经理并未向第一财经记者出示相关交易明细：“我们不能查阅相关账户的交易人和建仓时间等交易情况。”同时，该客户经理表示他们可为前来炒股的股民提供融资融券、民间配资等杠杆操作，从他了解到的情况来看，炒作雄安概念股的投资人如果想加杠杆，很少进行民间配资，往往是通过融资融券来进行操作。
4月17日，多只雄安概念股复牌，但是股价已经出现了明显分化，当天荣盛发展下跌了7.4%，冀东水泥下跌了4.48%，而京汉股份依旧上涨了7.39%，金隅股份继续涨停，但已非“一字涨停”那么坚决。
而这几只雄安概念股都和这家华泰证券北京西三环北路营业部有着关联，4月17日，该营业部在京汉股份上的净卖出金额为60178.11万元，占总成交的比例为9.93%，排在卖出席位的第一位。
该营业部4月17日还卖出冀东水泥34050.12万元，卖出金隅股份61078.14万元，上述三笔交易当天合计净卖出了15.42亿元。再加上该营业部之前几个交易日在荣盛发展上的多笔卖出，该营业部合计卖出雄安概念股套现25.21亿元。
在该营业部撤退后的第二个交易日，也就是在4月18日，无论是京汉股份、冀东水泥还是金隅股份，股价表现不振，分别出现了跌停，下跌8.28%和下跌4.74%，该资金的逃离可谓相当精准。
从4月7日至4月11日，雄安概念股炒作正处在热火朝天的时候，该营业部不停操作荣盛发展，从4月7日、4月10日、4月11日，分别净卖出了荣盛发展49364.46万元、24302.69万元、24264.74万元，合计卖出了9.79亿元。
上述客户经理表示：“资金应该是很早就开始一点点建仓买进雄安概念股，否则若是提前几日大幅买进相关股份，这样的大手笔也应该会出现在龙虎榜中。主力资金出逃冀东水泥、京汉股份和金隅股份，这或与前几日强监管密切相关。”
“从这个营业部的操作路线可以有一个大致推测，从4月7日之后的几个交易日之内，这个营业部主要是操作了荣盛发展，好几笔都还是涨停卖出，卖得有点早，之后又买进去冀东水泥、京汉发展等几只股票，但在雄安概念股风险转变之后就马上卖出，非常果断。”上海市某资深市场人士表示，至于为何会如此精准把握住雄安概念龙头股的原因，就不得而知了。
记者了解到，该营业部上榜龙虎榜的次数总体不多，除了上榜雄安概念股炒作之外，还在4月12日操作过粤高速A，当天合计净买入692.41万元，就在这一天粤高速A因为突然崛起的粤港澳概念而出现涨停。
事实上，这一资金量与其在雄安概念股上的投入相比可谓“小试牛刀”，可见该资金对于雄安概念更加认可。
此外，该营业部还在3月22日操作过西部建设，当天的卖出净额为1642.21万元。这一天，西部建设的股价同样出现涨停，涨停卖出已经成为该资金出货的惯用手法。
西部建设近期的股价也出现了大幅度的上涨，股价上涨主要还是因为其具有“一带一路”概念，而这一概念和雄安以及粤港高概念一样，同样都是属于目前A股市场上相当火热的“炒地图”。
而和3月份以来明显的“炒地图”操作路线不同的，早在之前该营业部还买入过汇纳科技、东北制药、顺发恒业等股票，相对来说，那个时候还并没有统一的风格。",http://www.yicai.com/news/5268828.html
2017-04-18 21:37,,英国突然提前举行大选 美股三大股指开盘低迷,"4月18日消息，英国突然宣布提前举行大选叠加高盛公布的糟糕的财报以及日趋紧张的朝鲜半岛局势，美股三大股开盘走低。标普500指数低开8.84点，跌幅0.38%，报2340.17点。 道琼斯工业平均指数低开89.81点，跌幅0.44%，报20547.11点。 纳斯达克综合指数低开19.78点，跌幅0.34%，报5837.01点。
消息面上，英国突然要提前举行大选，欧股全线走低， 英国富时100指数跌幅进一步扩大至2%，创去年6月英国公投脱欧以来最大跌幅。 英镑兑美元突破1.27关口，创四个月新高。
英国首相May称，议会当前存在分裂，更晚选举可能导致英国退欧谈判受到阻碍，自己最近才不情愿地选择举行选举。她称，将在周三向议会提出6月8日举行选举的动议。
美国副总统彭斯表示，将与盟国协作对朝鲜施加经济与外交上的压力。今天对于美日经济关系而言开启了全新的时代。美日两国均可拥有促进经济增长的货币政策与预算政策。
特朗普今天将签署新移民签证令，特朗普新的移民签证令将提高对外籍技术工人的要求，要求联邦政府部门进行改革，确保H-1B签证授予了技能、薪酬最高的申请人。
美国财政部长史蒂文.姆努钦表示，由于美国国会共和党废除“奥巴马医改”的努力遭遇重挫，特朗普政府的税改时间表或将有所推迟。
公司消息方面，苹果最快准备秋季推出3款iPhone.苹果计划升级现有的两款iPhone，并准备推出一款外观作出大幅调整的新iPhone。另外，苹果公司可能于5月份开始生产两款新iMac。
58同城网公布从腾讯控股融资2亿美元的协议，该融资将投资于转转APP。
Cardinal Health股价盘前跌幅近17%，稍早公司宣布将61亿美元现金收购Medtronic旗下病患监测与看护业务。
高盛一季度EPS 5.15美元;一季度交易业务营收33.6亿美元，预期36.2亿美元;一季度固收业务营收16.9亿美元，预期20.3亿美元;一季度投行业务营收17亿美元，预期15.6亿美元。盘前跌近3%。",http://www.yicai.com/news/5268807.html
