content,time,abstract,title
"中国股市遭遇至少五年内表现最差的一周。目前，投资者正在反复思量的问题是，中国股市全球罕见的涨势是否已走到尽头。
截至周五收盘时，上证综指(Shanghai Composite)下跌6.42%，令该指数本周跌幅达到13.32%，创7年来最大单周跌幅。
深成指收跌6.03%，令其单周跌幅达到13.24%。这将是自截至2009年2月27日的那周以来，该指数的最大单周跌幅。
出现这一巨大跌幅的原因之一，是活跃的首次公开招股(IPO)市场暂时将投资者及其资金从二级市场吸引过去。
以国泰君安证券(Guotai Junan Securities)周三的发行价计算，该公司IPO规模达49亿美元。根据Dealogic的数据，这是今年迄今规模最大的新股上市。它还是中国农业银行(Agricultural Bank of China)上市以来，中国A股最大规模的IPO。2010年7月，中国农行曾同时在香港和上海股市上市，募资总规模达221亿美元。
Dealogic分析师马宁表示：“中国发行商正在领跑全球新股上市，今年迄今已达成199宗交易，规模达到创纪录的348亿美元，比2014年同期的157亿美元增长了一倍以上。”
还有一个原因则是第二季度即将结束，银行可能在减少开支，准备迎接季末审查。
周四，楼市出现了较为乐观的数据。根据路透社(Reuters)用官方数据得出的计算结果，中国新房价格的跌势趋缓。不过，当天中国股市下跌逾6%。这一局面符合那句谚语——坏消息就是好消息——原因是它或许会降低中国政府推出更多刺激性举措的可能性。
过去一年里，沪深两市上涨了一倍以上。如今，它们是否正面临进一步调整？对于这个问题，不论是投资者还是分析师，都存在巨大分歧。
相对乐观的观察人士表示，沪指本周的巨大跌幅是短期因素导致的。而离岸投资者则日益看跌中国股市。
香港交银国际(Bocom International)董事总经理洪灏本周在报告中写道：“很明显，中国正处于泡沫之中。”
“为此，可以看看中国股市创世界纪录的周转率。这一周转率是美国的两倍以上，轻而易举地令其他所有股市相形见绌。迅猛增长的成交量，再加上居高不下的日周转率，都是处于泡沫状态高级阶段的特征。”
根据彭博(Bloomberg)的数据，周四收盘时，沪市12个月往绩市盈率均值为23.4倍，大大高于一年前的9.8倍。
美银美林(Bank of America Merrill Lynch)对全球基金经理开展的一项调查显示，每10个基金经理中就有7位认为中国股市处于“泡沫”之中。澳新银行(ANZ)援引EPFR Global的数据显示，在截至周三的一周内，中国股权基金录得21亿美元外流资金。而在此前一周，外流资金的规模达71亿美元。
译者/简易",2015年6月19日 13:06,沪深两市跌幅均超13%，乐观者认为本周巨大跌幅系短期因素所致，离岸投资者则看跌,中国股市遭遇7年来最大单周跌幅
"官方媒体的安抚性言论似乎对中国股市达到了预期的效果，沪深股市周二从上周的暴跌中部分反弹。
上证综指周二收盘上涨2.2%，为自6月1日以来最大涨幅，今日早盘曾一度下跌4.7%。
这是端午节小长假后的首个交易日，上周，中国股市遭遇自2008年以来最大跌幅。根据彭博(Bloomberg)的数据，上周，中国股市市值蒸发约1.3万亿美元，超过澳大利亚股市总市值。
上证综指上周下跌13.3%，这促使中国很多官方报纸纷纷发表社论和首页评论文章，对以散户为主的中国股市给予鼓励，让股民相信上涨行情是可持续的。
官方的《证券时报》写道，“波动乃是资本市场的常态，有大涨必有大跌，置身其中的各个主体，对此当有清醒的认识。理性分析当前市场环境，可以发现牛市的逻辑未变。”
一些分析师警告称，中国在吹大由政府支持的股市泡沫，因较为宽松的货币政策促使数百万散户投资者将资金从银行存款转向股市。融资融券贷款飙升，交易额升至创纪录水平。
然而，很多人认为，股市上涨行情将继续，一旦此次市场动荡显示出将演变为大跌的迹象，中国政府将出手干预。
因此，科技股众多的深圳股市今年仍累积上涨近一倍，即便在最近股市大跌之后。周二，深圳股市反弹1.2%。
“尽管影响因素不是单一的，但股市缺乏动力主要是对政府继续打击融资融券贷款以及首次公开发行(IPO)供应预计飙升做出回应，”贝莱德(BlackRock)分析师表示，“然而投资者应该明白，流动性以及央行的举措可能会继续助推中国股市。”
译者/梁艳裳",2015年6月23日 18:50,上周中国股市暴跌，官方报纸纷纷发表文章安抚市场情绪，本周二股市部分反弹,中国股市止跌回升
"知情人士称，中国顶级投资银行中信证券(Citic Securities)即将离任的董事长因涉及公司高管的内幕交易丑闻而被迫让位。
中信证券上周宣布，王东明（见文首图图中）“因年龄原因”将不再担任下届董事会董事长。64岁的王东明已超过国企高管60岁的标准退休年龄，但这种限制并非绝对。上述知情人士透露，丑闻曝光前，王东明本计划继续担任公司董事长一职。
中信证券是中国国有企业集团——中信集团(China Citic Group)旗下公司，后者是成立于1979年的国家投资工具。中信证券总经理等至少七名高管已经因涉嫌内幕交易被警方逮捕。
两名知情人士说，中信集团董事长常振明迫使毕业于美国乔治城大学的王东明退休，原因是后者未能监督好公司高管。中信证券一名高管称，替换王东明的决定来自党委官员。
“他对此极为不快，”王东明的一位长期同僚称。
今年6月至8月间，“国家队”为遏止导致5万亿美元市值蒸发的股市下滑投入巨额资金，而中信证券在此次国家金融机构救市中发挥了核心作用。两名知情人士称，中信高管涉嫌利用知晓国家队计划买入哪些股票而用自己的账户进行“抢先交易”。
中信旗下另一家公司的高管称，上周四，王东明在办公室将工作移交给自己的接任者，这表明他很可能将免遭起诉。王东明并未被指控存在不当行为。
“考虑到他的年龄，他被允许体面地退休，”该高管说，“金融业的地震才刚刚开始。”
中信证券及中信集团都拒绝置评。
Ma Nan补充报道
译者/申凯",2015年11月23日 07:48,原因是他未能在今夏国家队救市过程中阻止高管进行内幕交易,中信证券董事长王东明被迫退休
"今天，上证综指虽然收跌4.27%，却在收盘前的最后几分钟守住了关键的3500点关口。3500点关口被人们普遍视为会引发当局出手托市的支撑点位。
该基准指数今日最低曾跌至3492点——就在收盘前5分钟。但在这之后，一件人们完全能够预料到的事情发生了：最后时段的买盘将该指数推升了0.5%，令其收于3507.7点。
过去6周，曾有许多说法称，当局为上证综指设置了某种类似于交易区间的东西：3500点被视为区间下限，而高于4500点的点位则可能意味着泡沫太多了。
这种交易区间会维持多久目前完全不得而知，另外我们也无法确切知晓当局是否真的在买入股票。但我们知道的是，中国政府已将其信誉押在了股市的攀升上。它会容忍一定程度的抛售——但只是一定程度。
目前，该指数处于7月8日以来的最低点。7月8日曾出现2015年的最低收盘点位，在那之后，中国当局宣布了史无前例的举措、将动用一切必要手段来提振股市。
目前，上证综指已从6月12日的2015年峰值跌去了32%。不过，在过去12个月里，该指数仍上涨了56%。
就在今天的抛售行情出现之前，用来衡量制造业活动水平的财新(Caixin)采购经理人指数(PMI)降至6年半低点。此外，在A股暴跌之际，新兴市场发生的抛售也在向欧美股市扩展，从而加剧了整个正反馈循环，导致亚洲股市进一步下跌。
译者/简易",2015年8月21日 17:42,3500点关口被普遍视为会引发中国政府出手托市的“交易区间”下限,上证综指收跌4.27% 守住3500点关口
"新兴市场基金本周的资金外流达到金融危机以来最高水平。投资者从中国股市撤回了数十亿美元。
基金追踪机构EPFR发布的数据显示，在截至周四的一周里，新兴市场基金资金流出总量达到93亿美元，为2008年以来最高水平。其中，中国股票基金的资金流出量为71亿美元，而此前三周则出现了强劲的资金流入，5月最后一周甚至创下了流入46亿美元的纪录。同在5月最后一周，全球新兴市场基金流出资金8.29亿美元，拉美基金流失了4.42亿美元。
随着美元走强，新兴市场近来承受了更大压力。美元走强通常会导致新兴市场资产业绩放缓。过去一个月里，俄罗斯卢布对美元贬值8.6%，哥伦比亚比索贬值5.9%，马来西亚林吉特贬值3.2%。
新兴市场债券尤其受到了冲击。随着德国政府债券收益率提高、美国经济数据出现起色，投资者们开始重新思考持有低等级债券的风险。
许多发展中国家也已出现经济放缓，这是因为中国对原材料的需求大幅降低，国内信贷繁荣慢慢走到终点。
本周初，世界银行(World Bank)警告称，在西方国家经济活动开始显著回暖之时，新兴国家面临一场可能持续数年的“结构性放缓”。
中国股市——本周资金流出的主要资产类别——引发了市场另一种担忧。尽管经济在放缓，沪深股指在过去12个月里都上涨了一倍以上，使中国股市成为迄今全球表现最佳的股市。
然而，驱动中国股市上涨的主要因素在于数百万散户新开证券账户、高企的成交量和保证金借款快速增加。这一切都让投资者对一场政策诱导的泡沫感到害怕。
目前，上证综指(Shanghai Composite)的市盈率为25.7倍，高于一年前的区区9.7倍。对于在内地和香港两地上市的公司而言，其A股价格通常比H股价格高出38%，表明两地股市行情正日益背离。
本周，指数提供商MSCI明昇决定，由于市场准入限制等问题还未解决，暂不把中国A股纳入其全球新兴市场指数。如果MSCI明昇仓促行动、决定纳入A股，那么被动型基金将被迫投入数十亿美元买入中国A股。
澳新银行(ANZ)的分析师表示，本周资金流出中国股票基金可能是因为A股震荡加剧，但MSCI的决定或许也是背后因素之一。
译者/邢嵬",2015年6月12日 15:59,本周新兴市场基金资金流出总量达93亿美元，其中中国股票基金流失71亿美元,新兴市场基金遭遇7年来最大资金外流
"一个被动基准保持了原样——然而这对世界市场而言是件大事。
新兴股票市场的主要指数提供商MSCI明晟已决定，暂不采纳将中国内地A股部分纳入其旗舰新兴市场指数的建议。因为有价值1.7万亿美元的基金以该指数为基准，这一决定具有深远影响。
如今，A股能够被纳入的最早时间是2017年5月，届时目前A股的牛市（不到12个月涨了一倍多）很可能已经逆转。
MSCI明确表示，与中国有关部门的商谈仍在继续，它仍在向着最终纳入A股的方向前进，且随时可能做出纳入A股的决定。
然而就目前而言，关键在于中国尚未在三个方面让指数提供商信服：首先，向外国投资者分配额度的过程必须“更加顺畅、透明和可预测”；其次，资本必须获得更大流动自由，让所有投资工具拥有每日流动性；第三，沪港通机制的实益所有权问题必须得到澄清。
围绕所有这几个问题都已展开密集讨论。但看上去占上风的意见是，在一些投资者能够买卖A股、而另一些不能的情况下，让他们面对一个包括A股的基准是不公平的。
MSCI想要纳入A股——如今A股显然已是新兴市场世界的一大组成部分——但就目前而言，该公司认为中国有关部门做得还不够。
中国当局一直明显热衷于推动MSCI纳入A股，尽管许多怀疑论者声称，鉴于A股市场过去12个月内已翻番，这将导致境外资金在顶部接盘。
与此同时，这将对基金管理行业产生深远影响。中国的规模将加大在新兴市场内部配置资产的难度。
据MSCI介绍，若按照真实权重纳入全部A股，中国将占到新兴市场指数的43.6%。这固然准确反映中国对新兴市场的重要性，但会让资产经理几乎没法开展工作。
正如纽约Emerging Global Advisors的尼克•斯密西(Nick Smithie)所说，“中国对这个指数来说太大了”。
他怀疑不会有任何人认为，一只近一半资产配置在中国的“新兴市场”基金真正算得上多元化，并预测可能会出现一系列新的指数。
他提出，很快会出现许多新的指数类别，比如“除中国外新兴市场”，“除中国外亚洲”，以及“仅中国A股”。
就没有发生的事件而言，这件事算是大的。
译者/阑天",2015年6月11日 06:37,FT投资编辑奥瑟兹：这家指数提供商希望纳入中国A股，但占上风的意见是，在一些投资者能够买卖A股、另一些不能的情况下，让他们面对一个包括A股的基准是不公平的。,MSCI为何暂不纳入A股？
"周二，MSCI明晟集团表示，在“几个与市场准入有关的重要遗留问题得到解决”后，中国A股“有望被纳入”MSCI全球基准指数。
MSCI表示，今后几个月该集团将与中国证监会组建一个工作组，来解决几个关键问题。该集团还表示，一旦这些问题得到解决，可能就会宣布相关决定。
MSCI董事总经理兼研究部门全球主管里米•布赖恩德(Remy Briand)表示：“在向机构投资者开放中国股市方面，中国取得了切实的进展。在我们2015年的磋商中，我们了解到世界各地的主要投资者正迫切期待中国进一步放开A股市场——特别是在配额分配程序、资本流动限制以及投资实益所有权方面。”
随着以MSCI指数为基准或跟踪这些指数的投资组合经理转向中国内地证券，此举可能会令在上海和深圳上市的中国股票吸引到数十亿美元资金。
目前，跟踪MSCI新兴市场指数的基金，资产规模约为1.7万亿美元。
译者/简易",2015年6月10日 06:34,MSCI明晟表示，一旦“几个与市场准入有关的重要遗留问题得到解决”，就会宣布相关决定,中国A股“有望被纳入”MSCI指数
"英国另类投资市场(AIM)的监管机构开始从严对待中国企业的管理标准，此前几家中国企业的董事会爆发了冲突。
伦敦证交所(London Stock Exchange)要求二板市场中国上市企业的指定顾问(nominated adviser)审核客户的制度和流程，以确保这些制度和流程达到伦敦上市企业的标准。
“另类投资市场接纳的每一家公司的监管框架，与主板市场的规则没有什么不同，”伦敦证交所表示。
“我们定期联系指定顾问，以确保它们在审核来自存在特定风险的行业或司法管辖区的企业时格外警惕。”
伦敦证交所补充称：“今年早些时候，我们主动联系了所有中国上市企业的指定顾问，以确保它们评估这些企业的控制措施。”
每家在AIM上市的企业必须聘用一家指定顾问，以确保自己符合AIM的规则。
自2014年以来，已有13家中国企业从AIM退市。其中有6家因为失去指定顾问而被迫退市，另两家表示，退市原因是它们未能发布财务报告。
伦敦证交所采取整治行动之前，几家AIM上市企业的非执行董事与在中国经营业务的高管闹翻。
2014年底，福建制鞋企业奈步(Naibu Global)的驻英国董事被迫承认，他们与驻中国的董事会成员失去了联系。
食品添加剂企业——益康国际(Sorbic International)在其指定顾问辞职后，被AIM摘牌。此前该公司被罢免的首席执行官抓住对企业现金和企业印章的控制不放。
过去10年里，大约有80家中国企业加入了AIM，如今只剩下了约45家。其中有5家企业的股票在过去一个月被暂停交易。在受到更严格审查的企业中，大部分是2003年前上市的小企业。它们的市值往往介于200万英镑至2500万英镑之间，执行管理团队持有较大份额股票。
伦敦证交所表示，在这些中国企业中，没几家有大量的散户投资者。
就在本周，润滑剂企业——中国润源化工(China Rerun Chemicals)的指定顾问辞职，称其曾要求对该公司的制度和流程展开独立调查，但遭到了拒绝。
昨日，中国润源化工发布了反驳意见，称其并未拒绝委托进行评估，但评估请求是在中国公假期间发出的，而且指定顾问要求多收取2.5万英镑服务费。
译者/何黎",2015年10月10日 06:24,此前几家在英国二板市场上市的中国企业的非执行董事与在中国经营业务的高管闹翻,伦敦证交所收紧对AIM中国上市企业监管
"中国当局拘留了“涨停板敢死队”（一群以大胆投机闻名的对冲基金经理）的主要人物。
泽熙投资管理公司(Zexi Investment Management)的亿万富翁总经理徐翔因涉嫌从事内幕交易，在警方追捕之下被采取刑事强制措施。
在华东的浙江省沿海城市宁波，他是一个由基金经理组成的松散群体的“总舵主”，这些人以炒高自己看好的股票、使其涨停（触及中国两大证交所的单日涨幅上限）闻名。
今夏中国股市大幅下滑后，监管机构似乎在多管齐下整顿国内股市；中国很多散户投资者确信，只有那些掌握内部信息或者有权贵朋友的人，才能在国内股市赚钱。
监管行动的一部分涉及打击内幕交易（业内人士称，此类活动相当猖獗），而其他方面包括收紧对高频交易、衍生品和保证金贷款的监管。
另一起案件是，在一家外资贸易公司工作的两名中国高管因涉嫌操纵股指期货市场被捕。据官方的新华社周日晚报道，警方还将与外国执法机构合作，追查拥有该公司的两名俄罗斯高频交易员。
在最新版胡润百富榜(Hurun Rich List)上，徐翔是中国排名第188位的富豪，估计身家达到140亿元人民币（合22亿美元）。
据官方的《证券时报》今年7月报道，泽熙投资是中国资产管理规模超过100亿元人民币的28家对冲基金公司之一。根据在线理财平台“招财猫”(ZCMall)，该公司有五只基金产品的2015年总回报跻身于中国前20名之列。其中“泽熙3期”位居首位，在截至10月23日的一年回报率高达377%。
中国股市今年早些时候出现牛市行情，上证综指(Shanghai Composite Index)在一年里飙涨153%，6月9日触及七年高点，但随后开始下挫，至8月26日下跌45%。自那以来该指数已反弹19%。
8月和9月期间，中国最大券商中信证券(Citic Securities)的10多个高层因涉嫌从事与市场下滑有关联的内幕交易被捕。
中国的证券监管机构还把股市下滑归咎于股指期货市场的“恶意”卖空者，并在7月成立一个由公安部副部长带队的特别工作组展开调查。在出台新规则阻止投机行为后，股指期货的交易量大幅下降。
据当地媒体报道，宁波警方周日为了抓捕徐翔，曾把总长36公里、连通该市与上海的杭州湾跨海大桥关闭大约40分钟。据新华社报道，徐翔被拘留是针对内幕交易和股价操纵的调查的一部分。泽熙公司周一没有接听记者请其置评的电话。
此外，伊世顿国际贸易公司(Yishidun International Trading)的两名中国高管因涉嫌在6月和7月操纵中国股指期货市场被捕。警方称，在香港注册的该公司操作31个独立的期货交易账户以规避交易限额，然后利用地下钱庄把非法利润转移出境。
新华社援引警方的话称，伊世顿公司采用高频交易软件，一秒内最多可下单31笔。在其活动最频繁的6月26日，在与上证50指数(SSE 50)——其成份股是在上海上市的50只大市值股票——挂钩的期货的全部卖单中，该公司占了30%以上。警方称，伊世顿公司非法获利约20亿元人民币。
上月，中国的证券监管机构起草了限制使用高频交易的规则。这些规则将要求所有高频交易策略得到监管机构的预先批准，其服务器必须设在中国境内。8月，中国监管机构暂停了由美国对冲基金Citadel操作的一个账户，作为针对高频交易调查的一部分。
警方说，伊世顿公司总经理高燕利用亲友的名字开立期货账户，这些账户由该公司实际控制。据新华社报道，现年34岁的高燕在逃离内地后，近日已在香港落网。业务拓展经理梁泽中也已被捕。
伊世顿公司是由格奥尔基•扎亚(Georgy Zarya)和安东•穆拉绍夫(Anton Murashov)2012年在香港注册成立的。根据穆拉绍夫的领英(LinkedIn)个人资料，他是总部位于莫斯科的高频交易投资管理公司Quantstellation的董事总经理。记者联系不上这两人请其置评。
新华社称，中国警方正在“进一步加大国际合作力度”，尽力将仍在境外的伊世顿公司犯罪嫌疑人缉拿归案。
记者联系不上伊世顿公司请其置评。
译者/和风",2015年11月3日 07:40,泽熙投资管理公司的这位亿万富翁总经理因涉嫌从事内幕交易被警方追捕,中国“涨停板敢死队总舵主”徐翔被捕
"自2000年以来，MSCI明晟的旗舰新兴市场股指——MSCI新兴市场指数(MSCI EM)的构成日趋集中化，以该指数为基准的1.6万亿美元资金现在大部分配置在亚洲。
根据瑞银(UBS)策略师杰夫•丹尼斯(Geoff Dennis)的分析，亚洲在该指数中的权重达到创纪录的69.5%，而一年前为63.1%，2000年为略高于40%。
因此，（东部）欧洲、中东和非洲地区的权重降至17.6%，拉美的权重降至12.9%的创纪录低点，不到2000年权重的一半。
亚洲权重的大幅上升主要是由中国拉动的，中国的权重已从2000年的0.4%升至23.8%。
目前，这里所说的中国仅指在香港上市的H股。但从下月起，MSCI将开始把在海外上市的公司纳入单个国家指数以及综合基准指数，例如MSCI新兴市场指数。最大的影响可能是把在美国上市的中国公司纳入MSCI新兴市场指数，例如阿里巴巴(Alibaba)、百度(Baidu)和网易(Netease)，这将进一步提升中国的权重。
接下来，中国的沪深A股市场也可能被逐渐纳入MSCI新兴市场指数。今年6月，MSCI没有把中国A股纳入该指数，但表示未来“有望”纳入，并且成立了一个工作组考察尚存的障碍。
鉴于沪深两市总市值为7.61万亿美元（香港股市总市值为3.25万亿美元），中国的权重可能会翻倍。安石投资管理公司(Ashmore Investment Management)研究主管简•德恩(Jan Dehn)表示：“中国启动了一个用多年时间逐步开放其市场的进程，因此中国所占的份额必定会越来越大，越来越大。”
尽管中国在MSCI新兴市场指数中的权重大幅飙升，但中国的投资表现远远逊于其他多数新兴市场国家，自2000年以来，回报率仅为该指数平均水平的60%。
瑞银的丹尼斯表示，这表明中国权重的持续上升主要是因为指数界定范围的变动（例如纳入“红筹股”，即在中国内地以外地区注册、在香港上市的中国内地企业的股票）、新上市公司、现有股票已发行股份数量增加以及自由流通股规模扩大。
译者/梁艳裳",2015年10月27日 13:10,亚洲股票在该指数中的权重达到创纪录的69.5%，亚洲权重的大幅上升主要是由中国拉动的,亚洲“称雄”MSCI新兴市场指数
