content,time,abstract,title
"中国将延长一项禁止大股东出售股票的禁令——直至限制此类售股行为的永久规则生效。当局正试图平息市场对锁定期原定明天到期的担忧。
周一，中国蓝筹股指数沪深300(CSI 300)暴跌7%，引发了去年夏天的恐慌性抛售再次出现的可能性。在去年夏天的抛售中，中国主要股指一度跌去45%。
分析师将周一的下跌归因于人们担心该禁令即将失效。这一禁令是2015年7月初出台的。
周二股市恢复了稳定，不过据称这也是在由官方金融机构组成的“国家队”进场买入股票之后才发生的。昨天，中国各主要股指均收涨逾2%。
该禁令的延期可能会在短期内对市场起到宽慰作用。然而，它将令人质疑中国政府放开资本市场、降低道德风险的意愿。
根据花旗集团(Citigroup)分析师的说法，去年上半年大股东平均每月净卖出760亿元人民币（合117亿美元）。而在减持禁令启动之后，该数据变为每月净买入420亿元人民币。
花旗估计，当前禁令的失效将导致每月大约1000亿元人民币的售股压力。
昨天，据官方《上海证券报》(Shanghai Securities News)报道，中国证券监管机构正在起草新的限制大股东抛售股票的永久规则。
该报援引未公开的消息来源报道称，监管机构将把现有禁令（该禁令禁止持有一家上市公司至少5%流通股的股东出售股票）延长至新规定正式发布实施。
该报强调，监管机构会确保该临时性禁令失效与新的永久规定实施之间不存在空档期，这一保证旨在减轻投资者对大股东可能借机大举抛售股票的担忧。
北京方正证券(Founder Securities)分析师郭艳红表示：“大股东仍有许多可以动用的手段降低持股比例。对冲操作就是一个例子。这一举措更主要的是为了安抚市场情绪。如果他们想要售股，他们仍然能够做到。”
就在官方媒体上述报道之前，中国证监会(CSRC)周二发布声明称，正在“研究”限制大股东、公司董事和经理人减持股票的新的永久性规定。
证监会表示，正在考虑要求大股东提前披露股份减持计划。
译者/简易",2016年1月7日 07:27,当局试图平息市场对禁令失效后大股东将大举抛售股票的担忧,媒体称中国官方酝酿大股东减持新规
"中国国内股市大涨的一个负面影响，是导致资金从点心债(dim sum bond)市场中流出。今年以来，点心债发行额已同比下降了一半。
Dealogic数据显示，今年前5个月，离岸人民币债券的融资总额降到了76亿美元，而去年同期为150亿美元。中国企业的点心债发行额降低至13亿美元，为5年最低水平，去年则为125亿美元。
人民币债券需求疲软，部分原因在于中国股市上涨。自从去年11月沪港通启动以来，香港投资者从信贷市场撤出资金，向中国上市股票中转投了1480亿元人民币（合238亿美元）资金。当地银行竞相招揽人民币存款，导致利率升高。
香港金管局表示，3月香港的人民币存款总量已从去年12月的1万亿元降低至9510亿元。
投资者一直在寻求在中国股市中获益——仅仅今年以来，上证综指上涨50%，深成指上涨了一倍以上。深港通预计将于今年晚些时候启动，为全球的基金和香港的散户提供购买中国股票的另一条途径。
另一方面，中国内地本想发行债券的企业发现，它们获得融资比以往更容易了。为了应对经济放缓，中国央行(PBoC)已多次降息、降准，增加了国内金融体系的流动性。这有助于降低中国企业借债成本，也降低了离岸人民币市场作为融资渠道的吸引力。
点心债经常被视为应对人民币升值的一条途径。然而，这一因素在过去12个月里发生了巨大改变。去年，人民币自从跟美元脱钩以来，第一次发生对美元的年度贬值，因为资本外流抵消了贸易盈余不断扩大的影响。在中国境内融资成本变低之际，人民币又失去了升值的吸引力，投资者现在要求更高收益率才肯借出人民币。
人民币汇率在今年3月降至1美元兑换6.29元之后，又已反弹至1美元兑换6.22元。银行家希望，人民币保持稳定将有助于提振点心债的需求，但许多分析师预计，今年点心债销售量将低于去年。
中国企业仍在向投资者发行以其他货币计价的债务，今年以来欧元债务和美元债务销售量分别达64亿美元和440亿美元——为年初发行最繁忙的一年。
译者/邢嵬",2015年6月1日 17:17,资金涌入股市，加上境内融资成本降低，使得中国企业点心债发行额降至5年最低水平,中国股市大涨导致点心债需求疲软
"如果各项代理指标值得信任，那么沪市下月向境外投资者进一步开放将受到热烈欢迎。
迹象显示，“沪港通”的启动将受到热烈欢迎。这一项目将让持有离岸人民币(CNH)的香港和海外投资者在进入沪市方面享有迄今最大的自由。
近日来，投资者踊跃持有离岸人民币，将3个月人民币同业拆借利率从6月的1.5%推高至逾3%的2014年高点。
随着套利活动的加剧，在香港和上海两地上市的内地公司的H股和A股价差近来急剧缩小。
因为吸纳能力有限，德意志银行(Deutsche Bank)等一些金融机构近来不得不关闭中国交易所交易基金(ETF)，不再吸收新投资。
下面的图表显示出47家在上海和香港两地上市的公司H股和A股价差不断缩小。这一指数以100表示零价差，截至周三收盘时其数值为97。
分析师们发现，世界各地的投资者对“沪港通”项目兴趣浓厚。这个项目预计将于10月启动，尽管北京方面还未敲定启动日期。
“沪港通”带来重组全球投资的压力。
其中之一是对摩根士丹利资本国际(MSCI)等全球股指提供商构成压力，让它们面临两难：不将A股纳入股指，将削弱它们的影响力；将A股纳入股指，将降低它们的标准。
“沪港通”将带来的另一影响是推动离岸人民币进一步国际化。
投资机会的稀缺一直是阻碍人民币成为全球货币的最大不利因素。
译者/阑天",2014年9月26日 06:45,近日投资者踊跃持有离岸人民币，而沪港两地上市企业股票价差收窄,境外投资者期盼“沪港通”
"中信证券(Citic Securities)、海通证券(Haitong Securities)等中国最大的几家券商纷纷提前发布亮丽的中期业绩，这是长达一年A股牛市的果实。随着牛市逆转，各券商急于化解外界对于其财务实力的担心。
过去两周券商开始发布整体收入和利润，比完整数字预定出炉的日期早了大约一个月。随着A股大盘暴跌，券商股票受损严重。
在市场担心中国近期股市崩盘所造成的损害以及券商所起的作用，在香港上市的较大券商的股价已减半。
自本月A股市场触底以来，多数券商股票已反弹五分之一，虽然跑赢了大盘14%的回升率，但在这轮崩盘中，券商板块比其他板块跌得更惨。
包括中信、海通、华泰证券(Huatai Securities)以及广发证券(GF Securities)在内的多家券商也纷纷宣布回购以及员工和大投资者购买股票的行为。
券商板块股票在4月下旬见顶，原因是投资者开始担心中国股市上涨幅度，以及券商通过保证金贷款在助燃涨势方面起到的作用。今年在港上市的内地券商募资200亿美元，是此前4年融资总和的四倍，其中一半以上募资所得被用于发放新贷款。
中国政府本月竭尽全力在A股暴跌时稳住市场，具体措施包括抑制保证金贷款和暂停首次公开发行(IPO)，从而削弱了券商收入的主要来源。券商还被迫贡献190亿美元资金建立一只平准基金。
摩根士丹利(Morgan Stanley)中国金融业分析师徐然(Richard Xu)表示：“投资者现在正试图重新评估这对券商的影响，目前尚不明朗。”他还说，对于干预市场的代价与较平静市场之间的得失，各方的观点两极分化。
“这归根结底在于资产负债表风险，就此而言更稳定的市场也会保护他们。”
根据中国证券业协会(Securities Association of China)未经审计的数字，今年上半年中国上市证券公司实现808亿元人民币（约合130亿美元）利润，比去年暴涨337%。
广发证券报告净利润上升5倍，今年4月它在香港上市首日股价飙升30%。
华泰证券将于周二发布整体数字，其在5月市场快要见顶时上市。该公司股价已从谷底反弹了四分之一，但仍比发行价低四分之一，令腾讯(Tencent)和红杉资本(Sequoia Capital)等基石投资者蒙受惨重账目亏损。基石投资者接受为期半年的禁售期，以换取保证的股票分配额度。
牛市也减缓了券商佣金下降的压力，根据《金融时报》“投资参考”(FT Confidential Research)的数据，中国券商佣金从2013年的0.082%下滑至今年一季度的0.062%。在线券商的竞争加剧，再加上允许投资者开设多个账户，都增加了券商的压力。
译者/彩云",2015年7月27日 06:37,随着A股暴跌，在香港上市的大中型券商股价均损失惨重，但长达一年的牛市行情，仍令其中期业绩受益。因此各券商急于化解外界对于其财务实力的担心。,中国券商提前发布亮丽中期业绩
"全球影响力最大的对冲基金经理之一警告称，当美联储(Fed)最终采取加息举动时，可能引发类似于1937年的股市大跌。
资产规模达到1650亿美元的对冲基金集团Bridgewater的创始人雷•戴利奥(Ray Dalio)在一份写给客户与追随者的备忘录中表示，他正避免对金融市场大笔押注，原因是担心意料之中的美联储政策转变可能带来戏剧性的意外后果。
与此同时，国际货币基金组织(IMF)总裁克里斯蒂娜•拉加德(Christine Lagarde)警告称，美国加息可能引发新兴市场的不稳定，致使2013年美联储诱发的“缩减恐慌”(taper tantrum)再度上演。这些言论框定了事关重大的一次美联储会议，预计这家央行的政策制定者将在会上为美国近10年来的首次加息铺平道路。
在结束为期两天的商议后，预计美联储将在今日摒弃在加息之前保持“耐心”的承诺。市场对美联储加息的预期时间为6月或9月，但是美元飙升及一连串疲软的经济指标搅浑了本次会议的政策制定背景。
戴利奥直白的语气使备忘录在行业内广为流传。在备忘录中，戴利奥及其联名作者敦促美联储谨慎行事，并制定公开的B计划，以防货币政策收紧引发问题。
“我们并不确切地了解——美联储也不了解——多大力度的收紧会打翻‘苹果车’，”戴利奥及其同事马克•迪内(Mark Dinner)写道。
“我们希望美联储知道（我们肯定不知道），如果打翻了苹果车它究竟将如何纠正问题。我们希望他们在做出可能打翻苹果车的举动之前知道这一点。我们对自己的风险敞口很谨慎。出于以上解释的原因，我们不想进行任何集中押注，特别是在当前情况下。”
备忘录把眼下的金融状况与1937年的情况相提并论，当时是1929年股市危机后的第8年，也是导致股票估值激增的4年印钞政策结束之时。美联储过早收紧导致道琼斯工业平均指数(Dow Jones Industrial Average)在1937年下跌1/3，股市抛售持续至次年。
如今，很多分析师担心美联储的任何政策收紧将会带来连锁效应，尤其是对新兴市场，特别是加上美元走强的影响。尽管Bridgewater的投资风格严重依赖于计算机，但戴利奥的投资评论长期受到投资者重视。LCH Investments 2014年的一项调查显示，戴利奥的Pure Alpha基金（资产规模超过800亿美元）跻身于历来表现最好的基金之列。
译者/马柯斯",2015年3月18日 07:20,对冲基金巨头戴利奥称，美联储政策转变可能带来戏剧性的意外后果,“美联储加息可能引发股市崩盘”
"美国作为首次公开发行(IPO)首选地的地位得到了加强，最近帮中国电商企业阿里巴巴(Alibaba)完成重磅级上市之后，美国有望连续第四年成为全球新发股票筹资额第一的国家。
Dealogic的数据显示，今年迄今，企业通过在纽约证交所(NYSE)和纳斯达克(Nasdaq)上市筹得的资金总额已达770亿美元，是伦敦和香港IPO筹资额之和的两倍。
数据显示，今年迄今，美国股市IPO筹资额占全球IPO筹资总额的五分之二。美国股市IPO筹资额有250亿美元源自阿里巴巴，该公司本月早些时候完成了史上规模最大的一宗IPO。
与美国IPO筹资额激增同时出现的是，美国经济活动加快，标普500指数(S&P 500)和道琼斯工业平均指数(Dow Jones Industrial Average)接近纪录高点。以交易额衡量，眼下全球企业在纽约的IPO是2000年以来最活跃的，银行家和律师表示，部分原因在于美国投资者数量庞大。
“（美国）流动性深度大……这种深度的潜在投资在其他交易所根本找不到。”达维律师事务所(Davis Polk)合伙人尼克•克龙费尔德(Nick Kronfeld)表示，“（它）让企业能够接触到其他市场上没有的一大批金融机构。”
尽管纽约和香港在跨境IPO交易数量上仍不相上下，但海外公司在纽约上市筹得的金额远远高于香港。
市场数据提供商Ipreo的数据显示，除阿里巴巴外，以中国互联网企业和以色列、英国科技企业为首的海外公司通过在美上市筹得了114亿美元。相形之下，海外公司在香港上市筹得的金额为30亿美元。野村(Nomura)股权资本市场主管斯蒂芬•罗蒂(Stephen Roti)表示：“公司治理条款方面的灵活性，以及美国资本市场整体的声誉——这个环境使得纽约证交所成为上市首选地。”
在2009年和2010年这两年，拜一批中国国企（主要是银行）的重磅级上市所赐，香港主导了全球IPO市场。在阿里巴巴之前，全球两宗最大的IPO来自中国国有银行——中国工商银行(ICBC)和中国农业银行(ABC)。
但自那之后，这股大潮就变成了涓涓细流，中国最大最好的国企大多已经上市，没有多少私营企业有能力填补它们留下的空缺。
译者/阑天",2014年9月30日 06:54,继阿里巴巴成功上市后，美国有望连续第四年成为全球新发股票筹资额第一的国家,纽约IPO优势扩大
"上海股市昨日尾盘一度暴跌8%，收市创下5年来最大跌幅，这让人怀疑该市场的稳定性——此前在不到3周的时间里，上海股市上涨了近25%。
上证综指结束了不断创出3年新高的上涨行情，最终收盘下跌5.4%，至2856.27点。花旗(Citigroup)分析师将这种走势称为“上海惊魂”。这个以散户为主的市场在当日下午早些时候还一度上涨了逾2%。它今年以来的涨幅仍高达35%，令人担心已经出现泡沫。
此轮上涨是中国央行上月降息引发的——这是中国两年多来首次降息。人们认为这可能预示着中国将出台更多的宽松货币政策，这与美联储(Fed)准备收紧货币政策形成鲜明对比。
在其他地方的投资者担心美联储立场和美元上涨可能影响全球经济增长的时候，中国股市——在基本上仍然封闭的资本账户中运行——却一直聚焦于国内形势变化。
野村(Nomura)中国区股票研究主管刘鸣镝(Wendy Liu)认为，昨日的下跌是“亟需的获利回吐”造成的，因为散户投资者已经对新宽松政策兴奋过头。
尽管中国股市此前大幅飙升，经济数据却显示了楼市低迷对投资以及相关行业——包括钢铁和贱金属需求——的影响。刘鸣镝表示：“降息始终是为了支持实体经济，而非股市。”
昨日，人民币汇率跌至今年7月以来的最低水平，尽管中国央行在过去3天通过提高“中间价”来引导人民币升值。
然而，人民币汇率继周一下跌0.3%，昨日又下跌0.5%——人民币汇率可以在中间价上下2%的幅度内浮动。对一种受到严格控制的货币来说，这样的幅度相当大。
上海股市暴跌伴随着又一个创纪录的交易量：成交额达到1280亿美元，约为今年日均成交额的7倍。
尽管散户对股市重燃兴趣吸引资金从房地产等资产类别进入股市，但股票策略师一直警告，一旦股市下调，小股东杠杆融资的大幅增长可能加剧调整幅度，因为他们利用保证金购买股票，在股市下跌时将被迫抛售股票以满足证券公司追加资金的要求。
截至上周五收盘，未偿还保证金融资余额达到5750亿元人民币，比9月初高出逾三分之二。
昨日跌幅最大的股票中包括银行股，金融板块下跌7.6%，能源板块下跌7.4%。
十大板块全线下跌。彭博(Bloomberg)编制的中国证券股指数下跌5.8%。由于证券公司从股市日成交量的飙升中获益最大，该指数自今年10月末以来上涨了一倍多。
译者/邹策",2014年12月10日 07:29,花旗分析师将上海股市周二的大幅波动称为“上海惊魂”。野村分析师则认为，周二的下跌是“亟需的获利回吐”造成的，因为散户投资者已经对新宽松政策兴奋过头。,分析：“上海惊魂”的背后
"德国股市已成为欧洲央行(ECB)量化宽松计划的主要受益方，DAX指数(Dax index)首次突破12000点关口，并收于该点位上方。
欧元区股票的惊人表现（德国蓝筹股领跑）表明，欧洲央行提振欧元区经济、击退通缩的努力正在奏效。
甚至在欧洲央行上周打响其1.1万亿欧元量化宽松计划的发令枪之前，德国企业就已受到一些有利因素的巨大提振，其中包括低利率、急剧下滑的油价以及欧元走软，后者让它们的海外营收数字变大了。
根据数据提供商EPFR的数据，今年迄今流入欧洲股票基金的资金已有大约356亿美元，超过了此前于2014年第一季度创造的320亿美元的纪录。这些流入的资金正让德国的大企业受益，戴姆勒(Daimler)、大众汽车(Volkswagen)、宝马(BMW)、默克(Merck)、巴斯夫(BASF)和德国电信(Deutsche Telekom)等公司的股价都出现了强劲反弹。
今年DAX指数已累计上涨24%，除息后的表现超过欧元区其他股市。
由于量化宽松预期将四分之一的欧元区政府债券收益率压低至负值，寻求回报的投资者不得不将目光投向风险更高的资产，因此纷纷挤进股市。与十年期德国国债0.22%的收益率相比，DAX指数2.25%的股息收益率可谓十分诱人。
作为欧洲最大的出口国，德国已受益于量化宽松对欧元汇率的刻意压低。自今年初以来，欧元兑美元汇率已下跌12%。在DAX指数成分股企业的营收中，约22%是以美元计价的。相比之下，法国CAC指数(CAC Index)的这一比例只有14%。
译者/简易",2015年3月17日 07:44,受欧洲央行量化宽松计划影响，德国DAX指数首次突破12000点关口，并收于该点位上方,德国股市成欧洲央行QE大赢家
"周三，中广核电力(CGN Power)的股票在香港上市后上涨20%，凸显投资者从中国减少污染努力中获利的兴趣。中国正试图推广清洁能源减少污染。
中广核电力的上市是香港今年迄今最大规模的首次公开招股(IPO)，也是中国核电生产商首次在香港上市。开盘几分钟内，其股价一度跳升至每股3.45港元的高点，到早盘晚些时候，股价降至3.33港元，上涨五分之一。
由于散户和机构投资者对其股票需求强烈，该集团曾把发行价定在定价区间的高端，但上市后还是出现巨大涨幅。
中广核通过这次IPO筹集了31.6亿美元，计划将这笔资金用于买下台山核电(Taishan Nuclear Power)的多数控股权。台山核电旗下运营着两座核电站。
根据中广核电力的招股说明书，中广核成立于1979年，旗下拥有11座核电站，所发电量占中国核电发电量的55%。该集团所发电力中，多数被用于向华南广东省和福建省、以及香港自身的电网供电。
译者/简易",2014年12月10日 12:41,早盘上涨20%，凸显投资者对从中国减排努力中获利的极大兴趣,中广核香港上市首日股价大涨
"万达(Wanda)在中国内地上市的潜在借壳对象宣布终止谈判，这或许会让中国首富王健林感到头疼，目前他正寻求回归A股，用上海和深圳的较高估值取代表现不佳的香港上市。
深圳上市的绵石投资集团(Soft Rock Investment Group)昨日表示，其已退出关于将自身重组为万达商业地产(Wanda Commercial Properties)上市外壳的资产置换协议的谈判。
王健林今年早些时候斥资44亿美元，将在香港上市仅一年半的大连万达商业地产公司收归私有。那是中资集团在香港进行的规模最大的私有化交易，其在内地重新上市的成败受到密切关注，被视为其它公司可能效仿的模板。
Dealogic的数据显示，今年迄今中资企业宣布了超过120亿美元的私有化交易，而去年全年达到217亿美元。据信多数交易是为了寻求在估值高于纽约或香港的内地交易所上市。
但是，出现一波后门上市的可能性引起了中国监管机构的关注，他们担心企业通过借壳上市逃避首次公开发行(IPO)过程的审查。
今年以来，香港和内地股市有几十家疑似潜在外壳、正在寻觅后门买家的公司股价飙升，其背景是银行融资条件有所收紧，促使管理层物色其他融资渠道，包括公共股本。
在上海和深圳上市的外壳，还提供了跳过数百家排队等候IPO监管审批的内地公司的手段。
绵石投资在提交深圳证交所的一份公告中表示：“鉴于相关各方未能就本次重大资产重组的时间安排协商达成一致，为维护全体股东利益……公司决定终止本次重大资产重组事项的筹划。”
万达表示，只与绵石投资“进行初步接触”，“未就万达商业重组进行正式协议谈判，也未达成任何一致意向”。
译者/和风",2016年11月23日 07:11,在深圳上市的绵石投资宣布终止将自身重组为万达商业地产外壳的谈判，万达则回应只与对方进行过初步接触。,万达在中国内地上市的潜在借壳对象宣布终止谈判
"香港的股市监管机构以保持沉默、鲜少发布声明而著称。周四，该机构发布一句话声明，证实其正在就汉能薄膜集团(Hanergy Thin Film Power Group)的事务进行调查。这是该机构6年多来所确认的第二起实时调查。
就在香港证监会(SFC)发布声明的数小时前，汉能董事长李河君还否认了监管机构调查汉能的消息，称之为“纯粹是谣言，绝对不可能”。
虽然李河君的评论促使证监会出来说话，但后者拒绝透露其对汉能事务的调查是包括对该公司的约谈，还是在秘密进行——如果是第二种情况，那李河君当然就不曾知晓此次调查了。
当就此事被追问时，香港证监会又回到了习惯性的沉默。
香港证监会发布声明之前，本地一名公司治理维权人士公开表示他向证监会投诉过汉能的问题。
这位名为戴维•韦布(David Webb)的维权人士称，他曾请求证监会关注本月早些时候在《南华早报》(South China Morning Post)上刊登的一则汉能软广告，声称中国国家外汇管理局近期购买了汉能价值数十亿港元（10亿港元相当于1.3亿美元）的股份。该广告称，这笔投资是对该公司实力的认可，但该公司并未发布正式的股市公告。
“如果股票被买入，他们本应宣布这笔交易，但如果没有的话，那就是虚假和误导性信息，”韦伯表示，“对于虚假和误导性，你需要证明意图是这样的，即它会引发交易，这就是我的问题。”
香港证监会上次公开的一起调查是2008年10月针对中信泰富(Citic Pacific)——现在隶属中国中信股份有限公司(Citic Ltd)——误导投资者的行为，当时实际上公司的董事们已获悉一笔外汇对冲合约造成了20亿美元的亏损。
去年，香港证监会对该公司以及5名当时的董事提起了民事诉讼，寻求法庭颁发赔偿令以及对市场不当行为进行处罚。
记者未能联系上汉能对韦伯的投诉进行置评。
译者/陈隆祥",2015年5月29日 06:55,对汉能薄膜发起的行动，是香港股市监管机构六年来公开确认的第二起调查,香港证监会因汉能调查打破沉默
