content,time,abstract,title
"中国通过释放银行资金以刺激经济的决定未能引发亚洲市场上涨。上证综指周一（4月20日）收盘下跌1.64%，深圳股市下跌1.96%
上周日，中国央行(PBoC)采取措施，将商业银行存款准备金率下调1个百分点，以刺激经济增长，释放针对企业的贷款资金。
此举是自2008年11月以来中国央行规模最大的一次降准，此际，中国3月当季的经济数据疲软，暗示经济放缓。
尽管分析人士普遍认为这一降准举措将利好股市，但因中国证监会上周五晚公布收紧融资融券规定，降准举措的利好影响受到抑制。
麦格理(Macquarie)分析师预测，今年中国央行将出台更多宽松举措，包括5月的降息、加大基础设施支出以及放松房地产政策。
麦格理分析师表示：“预计（今年3月当季）将是今年最黯淡的时刻，中国经济将在（6月当季）转好，不过速度不快。”
“与此同时，我们预测在今年剩下的时间，中国将再次降准50个基点，而且未来5年，可期中国会因结构性原因降准20次。”
在中国上市的银行股多数下跌，中国农业银行(ABC)是个例外，上涨0.4%，至4.04元人民币。中国银行(Bank of China)下跌0.4%至4.91元人民币。
澳元兑美元汇率回吐早先涨幅，但仍在0.78澳元水平之上。澳元汇率通常被视为一个衡量中国经济增长的指标。日元兑美元汇率略有上涨，至118.87日元。
在亚洲其他地区，日本日经指数(Nikkei)下跌0.1%，香港恒生指数(Hang Seng)下跌0.4%。
澳大利亚S&P/ASX 200指数在亚洲主要指数中表现最差，下跌1%。
译者/梁艳裳",2015年4月20日 15:46,因中国证监会上周五晚公布收紧融资融券规定，央行降准举措的利好影响受抑,中国降准举措未能提振股市
"汉能薄膜发电(Hanergy Thin Film)股票虽已停牌，但股东们正通过私人交易进行异常活跃的买卖。投资者权衡着该股持续停牌和监管机构对其展开调查可能带来什么结果的风险。
这些交易多数是由银行牵线的，它们试图在没有现成市场价格的情况下，撮合买家和卖家，这种操作带来一些折扣较大的买卖。
据银行家和投资者透露，买入价和卖出价介于0.50港元和2港元之间，相比每股3.91港元的最后公开交易报价存在最高达87%的折扣。
这家太阳能设备制造商在5月20日申请停牌，此前其股价在半小时里暴跌47%，抹去190亿美元市值。汉能薄膜发电请求停牌时表示将刊发相关公告，但迄今尚未发表该公告。
一周后，香港证监会(SFC)宣布正在调查该公司，此举有可能使该公司的复牌努力复杂化。
停牌以来的场外交易大多是在被动投资者（如指数基金）与对冲基金（它们此前借入该股进行卖空操作，现在必须买回股票归还）之间达成的。
据香港银行家介绍，汉能薄膜发电股票的交易在兴趣水平和成交数量上都显著高于寻常的停牌股票。
本周古根海姆投资(Guggenheim Investments)宣布，它已出售了为三只交易所交易基金(ETF)持有的汉能薄膜股票，但它拒绝透露价格。
古根海姆表示：“我们从ETF股东的最佳利益出发采取此举。”
汉能薄膜在产品销售上对内地母公司汉能集团(Hanergy Group)的依赖，以及股价飙升（2015年在下跌之前上涨160%），使其早在崩盘之前就吸引了越来越多投资者的目光。
卖空者的目的是获利于不断下滑的股价，据信当该股暴跌时，他们持有大量亏损头寸，因为许多卖空者去年开始借入该股准备卖出时，该股股价更接近1.20港元；该股在今年4月曾触及7.88港币。
银行交易员表示，一些潜在买家报出区区0.50港元的买入价，尽管迄今看到的最低交易价为1.50港元，这意味着一些卖空者仍然亏本。
“你必须权衡一下，一方面是承受3毛钱的亏损脱手，另一方面是在资产负债表上背负这笔交易的成本，不知道接下来会发生什么，”一名银行家表示。
停牌前，借入汉能薄膜股票进行卖空操作的成本飙升高达30%，对多数对冲基金而言贵得受不了。据股票出借部门透露，5月20日当天，欧洲和美国对冲基金对卖空该股的兴趣激增，尽管该股已被停牌。
译者/和风",2015年7月3日 06:33,据悉这些交易多在被动投资者与对冲基金之间达成，与最后公开交易报价相比，最高有87%的折扣,汉能薄膜股票场外交易异常活跃
"香港离岸人民币利率本周大幅攀升，接近历史高点，这是因为香港各银行争相吸收资金，以备战期待已久的“沪股通”。“沪港通”将首次允许中国境外投资者直接投资于中国内地股票市场。
近些天来，包括汇丰(HSBC)、花旗集团(Citigroup)和渣打(Standard Chartered)等多家银行提高了利率。而包括中国银行(BoC)和中信银行(Citic Bank)在内的多家中国内地银行的香港分支机构，提高利率的幅度更大。
离岸人民币利率上升的同时，由于中国央行连续注资，近几周中国内地人民币利率已有所下降。
“沪港通”并未按计划在10月末开通。但香港和上海两地的外汇官员都表示，技术准备已完毕，而市场参与者仍希望它在未来几周或几个月内开通。
跟中国的合格境外机构投资者(QFII)制度不同，“沪港通”不提供将外币兑换为人民币的机制。
参加“沪港通”的香港投资者需要从离岸人民币市场上获得人民币，这一市场不受监管，但与在岸人民币市场并不连通。截至9月底，香港离岸人民币存款达到9440亿元人民币（合1540亿美元），跨境贸易人民币结算是香港地区各银行离岸人民币不断积累的主要动因。
人民币合格境外机构投资者(RQFII)制度的发展，在一定程度上增加了市场对离岸人民币的需求。被称为“点心债”(dim sum bond)的离岸人民币债券市场的壮大，也发挥了类似作用。
即将启动的“沪港通”将进一步刺激市场对离岸人民币的需求。“沪港通”比RQFII的限制更少，可投资资产范围远不止于点心债市场，这预示着在岸与离岸人民币汇率将进一步趋同。
译者/邢嵬",2014年11月6日 16:57,“沪港通”进一步刺激投资者对离岸人民币的需求，导致香港离岸人民币汇率大幅攀升,香港各银行竞相加息备战“沪港通”
"对亚洲的许多股市来说，今日的早盘都算不上美好。而香港恒生指数(Hang Seng Index)的表现尤为失败，今日盘中跌幅逾4%，已步入调整阶段。
恒生指数盘中一度跌破25000点大关，跌至24792.02点，跌幅约为4.8%。该指数今日很可能创下2011年11月20日以来的最大单日跌幅。
今年4月28日，恒生指数收于28442.8点，是金融危机后的最高点。自那以来，该指数一直在缓步下跌。但今日的下跌意味着，该指数已比上述峰值低了11.8%，从而在技术层面上步入了调整阶段（见图表）。恒生指数一年来的涨幅已收窄至6.9%。
过去三周，中国内地股指下跌了约30%，导致中国内地股市总市值蒸发了大约3万亿美元。而恒生指数也连续三周出现下跌。
自中国内地股市6月12日见顶以来，恒生指数已累计下跌7.5%。只有两只股票——航空公司国泰航空(Cathay Pacific)和电力公司中电控股(CLP Holdings)——在此期间有所上涨，但它们的涨幅都不大，分别为2.6%和0.5%（见图表）。
在此期间，恒生指数成份股中表现最差的是香港交易及结算算所有限公司（Hong Kong Exchanges & Clearing，简称：港交所），累计下跌了21%。虽然今年头三个月该公司股价呈横盘走势，但在4月份大幅飙升，至5月末涨幅已高达80.2%。
港交所被视为成交量增加的受益者之一，去年沪港通开通后，其成交量达到创纪录高位。沪港通允许香港和上海股市的投资者在对方的市场交易。
恒生指数的50只成份股中，有数只是在港上市的中国内地企业的股票。
译者/何黎",2015年7月6日 14:39,受中国内地股市下跌拖累，恒生指数今日很可能创下2011年11月以来的最大单日跌幅,恒生指数盘中跌破25000点大关
"美国经济第三季度增速快于最初估算，强劲的增长势头可能使美联储(Federal Reserve)更有理由下月启动加息。
美国商务部(Commerce Department)周二公布对第三季度国内生产总值(GDP)的第二次估算时表示，GDP按年率计算增长2.1%，高于上月预估的1.5%。
此次GDP报告的出炉正值美联储表示将考虑在12月的会议上启动加息。
虽然第三季度经济增速仍远低于第二季度录得的3.9%，但这些强劲数据——由消费者加大支出驱动——应当会让美国的政策制定者们更加坚信国内经济处于稳定增长的轨道。
译者/陈隆祥",2015年11月25日 07:21,经济强劲增长势头令美联储更有理由下月加息,美国上修第三季度GDP至2.1%
"上周，在中国两大证券交易所过半数股票停牌的情况下，挂钩中国股市的交易所交易基金(ETF)经历了一场极限压力测试。
根据数据供应商EPFR的数据，跟踪中国股市的ETF上周获得了创纪录的135亿美元资金净流入。一位证券经纪人推测，中国政府正把ETF用作股市维稳工具之一。
美银美林(Bank of America Merrill Lynch)表示，资金集中流入在中国内地上市的A股ETF，“反映的是托市举措，而非私营部门的需求”。
尽管中国政府推出种种举措试图阻止股市暴跌，但在境外上市的A股ETF仍可继续交易。此次暴跌导致A股蒸发逾3万亿美元市值。
德意志资产及财富管理(Deutsche Asset and Wealth Management)亚洲被动资产管理部门主管马尔科•蒙塔纳里(Marco Montanari)表示：“尽管标的股票停牌，但我们跟踪中国A股的EFT仍然交易活跃。”
蒙塔纳里补充称，由于市场波动性上升，中国ETF的交易成本有所升高，但流动性仍然充沛。该公司在美国上市的中国A股ETF上周交易额超过17亿美元。
ETF Securities驻伦敦执行董事Howard Li表示：“中国A股ETF正成为有用的价格发现工具。那些直接持有停牌股票的投资者无法交易，而持有ETF的投资者仍可在这个动荡的市场获得流动性。”
为境外资金提供中国A股直接敞口（不利用衍生品）的ETF于2013年底首次在美国推出，2014年初在欧洲问世。
初期，市场对这些ETF的需求相当强劲。根据咨询公司ETFGI的数据，2014年，在欧洲和美国上市的中国ETF的资金流入规模接近12亿美元。然而，亚太地区出现的抛售压力抵消了这些正向流入，去年该地区投资者从中国ETF中撤资38亿美元。
译者/梁艳裳",2015年7月13日 11:45,上周，跟踪中国股市的ETF获得了创纪录的135亿美元资金净流入,资金大举流入挂钩A股的ETF
"基石投资者在香港今年以来的新股发行中占了近一半的分量，银行家们担心，这种创纪录水平的比重正在扭曲股票价格，削弱世界领先股权资本中心之一的信誉。
基石投资者接受六个月的禁售期以换取较大数额的股票分配。Dealogic的数据显示，此类投资者在今年迄今首次公开发行(IPO)的97亿美元筹资总额中占了46%。
下月中国邮政储蓄银行(Postal Savings Bank of China)赴香港上市拟融资80亿美元，这将是2016年迄今世界最大IPO，届时上述比例势必将首次升至50%以上。
预计在此次上市启动时，60%至80%将分配给基石投资者。
银行家们表示，香港对基石投资者越来越依赖，已使这种方式日益演变成一种降低交易失败风险的形式。当初金字招牌投资者只是被用来激起对新股发行的兴趣。
这种做法在2010年中国农业银行(Agricultural Bank of China)进行220亿美元上市——那时是史上最大IPO——后变得更为普遍。
那笔交易在动荡的市场上启动，得到基石投资者55亿美元的提振，但该年禁售的股票仅占总量的15%。
去年在香港进行的IPO有五分之二股票被分配给基石投资者。若剔除今年迄今在上市交易中被锁定的资本，香港交易所(HKEx)在筹资排行榜上将从第一位降至第四位，落后于纽约证券交易所(New York Stock Exchange)、上海证券交易所(Shanghai Stock Exchange)和纳斯达克(Nasdaq)。
6月份，国银租赁(CDB Leasing)在香港创下新的纪录，其8.10亿美元的IPO有78%被分配给基石投资者，使参与这笔交易的13家银行只需招徕1.82亿美元投资。
本月进行了11亿美元上市的光大证券(Everbright Securities)排在第二位，有67%被分配给基石投资者。
“我们都知道，有时，完成交易可能比具体交易方式更重要，特别是对于一家国有企业，”某跨国银行的一名股权业务主管表示。“我不认为70%以上的基石分配比例对市场是真正健康的。”
银行家们不准备公开评论，因为上市是其很大一块业务。
中国内地企业，尤其是国有企业的上市，一直是香港股市最大和最稳定的营收来源之一。
全球而言，股权资本市场占投行业务报酬的大约四分之一，但在亚洲这个比例达到五分之二，与此同时激烈竞争把费用压低至只有美国IPO的一小部分。
一名股票交易主管称，基石投资者的持股造成很多新近上市的股票在二级市场“几乎处于休眠状态”。
“结构上，这对香港是一个问题。由于这些俱乐部交易，一段时间以来一直是这种情况，”他补充说。
银行家们表示，大量股票禁售所导致的流动性不足，抑制了相关股票的交投，同时也拖累了潜在的涨幅。
今年在香港进行的融资5亿美元以上的六笔IPO交易中，没有一只新股在首日出现涨幅。而在纽约，七笔此类规模IPO中，只有两只新股的股价在首日下降，其余新股的首日涨幅至少为5%。
2015年，负责审查所有IPO的香港交易所上市委员会(Listing Committee)在进行审议后得出结论，不能明确认为基石投资者导致股东基础狭窄或者导致流动性减少。
“委员会决定，现阶段没有理由出台额外法规，但是本交易所将继续监督这方面的发展，”香港交易所表示。
译者/和风",2016年8月29日 06:06,今年以来，基石投资者在香港IPO融资额中占了近一半比重，银行家称，这使很多新股在二级市场“几乎处于休眠状态”。,香港IPO日益依赖基石投资者
"华尔街分析师大幅调降了对第一季度美国企业盈利的预期，原因是油价暴跌和经济增长放缓令企业难以应对。
人们的悲观情绪越来越强烈之际，随着全球经济增长前景变得黯淡（尤其是中国经济放缓带来不确定性），股市今年出现了极为糟糕的开局，标普500(S&P 500)指数出现了大幅波动。
根据FactSet的数据，今年伊始分析师们预计美国第一季度每股盈利会恢复增长，同比增幅达到0.6%。自那以来，他们已经把盈利估计下调至降低7.4%。
RidgeWorth Investments资产配置主任艾伦•盖尔(Alan Gayle)表示：“企业在这种低增长环境下似乎难以获得增长动力，这给企业盈利带来了下行压力。”
在这一企业利润可能缩水的季度之前，美国遭遇了自金融危机爆发以来的最差业绩报告季，企业盈利连续三个季度下跌，营收连续四个季度下滑。
起初，人们曾预计2016年会出现止跌回升的现象。然而，这一预期已在很大程度上被重新评估，原因是能源企业因原油价格跌至13年低点而致预期盈利下滑93%，这一下跌幅度几乎是分析师们两个月前对该产业预计降幅的两倍。
对标普500成分股企业的预期是营收缩水0.6%，而在去年年底分析师曾预计会增长2.6%。
贝莱德(BlackRock)首席投资策略师拉斯•凯斯特里奇(Russ Koesterich)表示：“我们面临的是一个全球增长预计将会放缓、金融市场状况趋紧、能源价格进一步下滑的世界。所有这些都是市场层面上的不利因素，对营收的增长十分不利。”
预计不论营收还是利润，在今年下半年以前都不会恢复增长。投资者表示，不断恶化的前景可能意味着股市会进一步下跌。
“市场情绪最近已趋于稳定。”盖尔表示。“我认为这些负面的下调还未真正被人们认识到。从这个角度来说，我认为随着一季度业绩公布季节日益临近，市场还存在更多下行风险。”
企业自身的前景展望也令投资者失望。
标普500指数的成分股企业中，大约有110家企业发布了第一季度每股盈利指引，其中88家企业发布的预期低于分析师的预测，这一比例高于72%的五年平均。
译者/简易",2016年2月29日 07:05,今年初分析师们预计首季每股盈利会恢复增长，但现在他们估计盈利降低7.4%,美国企业首季盈利预测遭下调
"汉能控股集团(Hanergy Group)创始人李河君增持了该集团在香港上市的太阳能公司的股份，在该股今年以来上涨180%的情况下，这一举动凸显出他对该公司前景的信心。此外，这一增持在不到一周的时间里就净得480万美元账面收益。
在港上市的汉能薄膜发电(Hanergy Thin Film)近几个月来受到检视，原因是其股价飙涨，并且有大量销售收入来自向母公司销售产品。汉能薄膜发电股价6个月来已上涨350%，使其成为香港股市上表现最为优异的太阳能设备供货商。
然而，根据香港交易所(HKEX)的披露信息，过去一周里，李河君斥资3390万美元（合2.64亿港元），以每股6.9至6.92港元的价格买入了更多汉能薄膜发电股票。
汉能控股集团没有立刻回复记者的置评请求。
自4月16日以来，汉能薄膜发电的股票成交价在每股6.9至6.93港元之间，但昨日该股跳涨14.2%，收于每股7.88港元，这让李河君最近增持的这笔股份获得了480万美元的账面收益。
应港交所要求，汉能昨日发布另一份公告，表示自己不知悉有任何原因导致昨日股价和成交量上升，也没有任何根据规定必须披露的信息。
根据披露信息，李河君现净持有汉能薄膜发电74.95%的股份。香港要求上市公司公众持股比例至少达到25%。
汉能薄膜发电市值422亿美元，是其最大竞争对手——在美国上市的First Solar——的6倍，超过中国其余所有太阳能企业的市值总和。
除股票涨幅外，汉能薄膜发电的大量销售收入依赖于向母公司销售产品，这也受到分析师质疑。汉能薄膜发电的母公司——李河君私人控股的汉能控股集团，过了很久之后才支付了其子公司计入销售收入的款项。汉能薄膜发电表示，近几个月来它与中国内地一些第三方签订了合同，从而减少了对母公司的敞口。
译者/何黎",2015年4月24日 06:47,李河君过去一周增持了汉能薄膜发电股份，不到一周便净得480万美元账面收益,汉能创始人增持股份
"中国上证综指今日上涨3.04%，收盘至4527.40点，今年涨幅已超过39%。过去12个月，上证综指已累计上涨逾120%，目前为7年高点。
此际，投资者认为，在更多疲弱经济数据出炉之后，政府可能会出台经济刺激举措，汇丰银行(HSBC)采购经理人指数(PMI)触及12个月低点。
此时中国公布了一些疲弱数据，根据国家统计局(NBS)的数据，今年3月工业利润同比下降0.4%。
在股市上涨期间，交易员感到有些担心，因为上证指数14天相对强弱指标(RSI)已超过代表股市处于“超买”区域的70关口。
该指标读数越高，股市回落的几率就越大，不过是短暂的。14日RSI指标已连续5周多远远超过70了。目前为82。
译者/梁艳裳",2015年4月27日 17:22,投资者认为，在更多疲弱经济数据出炉之后，政府可能会出台经济刺激举措,中国上证综指收盘创7年高点
"万洲国际(WH Group)在香港挂牌交易首日表现强劲，给世界最大猪肉生产商断断续续的上市故事画上句号。
昨日早盘，这家中美公司的股价曾上涨10%，当天收涨7.4%。
总部位于中国河南的该公司是去年中国双汇国际(Shuanghui International)以70亿美元收购史密斯菲尔德食品公司(Smithfield Foods)的产物，之前两者都是各自市场的最大企业。万洲国际还持有欧洲肉类制品企业Campofrio逾三分之一的股权。
万洲国际的上市之路漫长而又颠簸。该公司去年11月聘用银行之后，最初寻求在今年4月上市——距离收购史密斯菲尔德食品公司案获得监管批准仅仅6个月。
万洲国际最初目标是筹资超过40亿美元，同时私人股本股东寻求出手更多股票，一度令潜在筹资金额高达62亿美元。
但知情人士当时表示，投资者拒绝接受他们认为过高的估值，并对该公司迅速谋求首次公开发行(IPO)表示担忧。万洲国际也遭到了批评，因为其向两位高管支付近6亿美元股票奖金，导致公司2013年发生亏损。
万洲国际的对策是将IPO规模砍掉一半、降至不到20亿美元，并将上市时间推后一周，但保持发行价范围不变。
此举未能让投资者满意，被迫令人尴尬地在最后时刻宣布暂停上市。许多人认为，万洲国际需要等几个月才会再次发起上市努力。
然而，万洲国际把办理上市的银行数量从创纪录的29家砍到摩根士丹利(Morgan Stanley)和中银国际(Bank of China International)两家之后，上周得以重启上市努力，通过迅速、低调的交易筹资逾20亿美元。
万洲国际昨日发行价的市盈率为11.5倍，低于4月15至21倍的初始目标。重启上市努力时提交的上市文件显示，第一季度利润显著上升，这也帮助降低了市盈率。
IPO筹得的现金将用于偿还融资收购史密斯菲尔德食品公司所欠约40亿美元债务的一部分。
译者/邢嵬",2014年8月6日 06:56,世界最大猪肉生产商漫长而曲折的上市故事终于画上一个句号,万洲国际在香港顺利上市
"去年，北美上市公司数量占到全球2500家市值最高公司的逾三分之一，这是自金融危机之前以来的首次。
相反，发展中国家上市公司的占比出现下滑。2013年，这些上市公司在全球市值最高的2500家公司中的比例为略超过四分之一，但在去年期间，这一比例下滑3个百分点，至22.7%。
咨询公司思略特(Strategy &，前称博斯(Booz and Company))的分析显示，美国和加拿大上市公司在全球2500家市值最高上市公司的占比达到2006年（该年为近40%）以来最高水平。
但在市值最高的2500家上市公司中，来自日本和西欧的上市公司数量仍低于2006年水平，分别为8.6%和21.6%。
思略特合伙人博奥拉•卡尔森(Per-Ola Karlsson)表示，这些数据在一定程度上反映了汇率影响，公司市值是以美元计算，而去年美元汇率尤为强劲，但两个根本推动因素是个别经济体中上市公司的表现以及并购活动升温。
他表示：“这些结果反映出美国经济的反弹力度强于其他经济体。”
Dealogic的数据显示，去年宣布的并购交易价值为3.6万亿美元。这是有记录以来的第三高年份，仅次于2006年和2007年。
其中美国占全球并购活动的45%，为自1999年以来最高。
卡尔森表示，并购活动再度变得重要，可能有助于解释北美公司为何会在全球2500家市值最高的上市公司中占据更大比例。
发展中经济体上市公司占比总体下滑掩盖了一些国别差异。
卡尔森表示，最显著的特点是中国的比例从2013年的8.3%下滑至去年的7.9%。
“这可能只是反映了美元的强势，”他表示，“但即便你剔除了汇率影响，这一数据仍令人感到意外，因为中国没有遭遇其它国家那样的危机。”
他还指出了去年大宗商品价格下跌对依赖石油、天然气、金属和其他资源的经济体的影响，因为这既影响了这些经济体中一些市值最高公司的市值，也影响了这些经济体的货币价值。
从国家层面来看，巴西占比的下滑速度最为明显，该国上市公司占比下滑三分之一，至1.6%。
去年，金砖国家（Bric，巴西、俄罗斯、印度和中国）以外的发展中经济体上市公司在全球2500家市值最高上市公司占比的上升势头遭遇10多年来首次挫折。2013年，来自墨西哥、尼日利亚和泰国等新兴市场上市公司的占比首次达到十分之一以上。
译者/梁艳裳",2015年1月15日 07:13,但2014年中国公司在全球2500家市值最高上市公司中的数量占比降至7.9%,北美公司市值强势回归
